{
  "schema": "heir.initialization_validation_plan.v1",
  "status": "draft",
  "checkpoint": {
    "path": "../artifacts/development/generic_heir.pt",
    "sha256": "0000000000000000000000000000000000000000000000000000000000000000"
  },
  "evaluation_artifact": {
    "path": "../artifacts/development/heldout_initialization_evidence.npz",
    "sha256": "0000000000000000000000000000000000000000000000000000000000000000"
  },
  "label_source": {
    "path": "../artifacts/development/independent_initialization_labels.npz",
    "sha256": "0000000000000000000000000000000000000000000000000000000000000000"
  },
  "latent_target_source": {
    "path": "../artifacts/development/registered_image_latent_targets.npz",
    "sha256": "0000000000000000000000000000000000000000000000000000000000000000"
  },
  "held_out_donors": [
    "development_holdout_donor"
  ],
  "seeds": [17, 41, 89],
  "thresholds": {
    "minimum_macro_f1": 0.65,
    "minimum_image_shuffle_macro_f1_delta": 0.05,
    "minimum_latent_cosine": 0.30,
    "minimum_image_shuffle_latent_cosine_delta": 0.05,
    "maximum_latent_rmse": 1.0,
    "maximum_ece": 0.10,
    "maximum_brier": 0.25,
    "minimum_predicted_class_occupancy_fraction": 0.75,
    "minimum_per_type_support": 25
  }
}
